"","field","required","type","description","table","schema"
"1","condition_occurrence_id","Yes","INTEGER","A unique identifier for each Condition Occurrence event.","condition_occurrence","cdm"
"2","person_id","Yes","INTEGER","A foreign key identifier to the Person who is experiencing the condition. The demographic details of that Person are stored in the PERSON table.","condition_occurrence","cdm"
"3","condition_concept_id","Yes","INTEGER","A foreign key that refers to a Standard Condition Concept identifier in the Standardized Vocabularies.","condition_occurrence","cdm"
"4","condition_start_date","Yes","DATE","The date when the instance of the Condition is recorded.","condition_occurrence","cdm"
"5","condition_start_datetime","No","DATETIME","The date and time when the instance of the Condition is recorded.","condition_occurrence","cdm"
"6","condition_end_date","No","DATE","The date when the instance of the Condition is considered to have ended.","condition_occurrence","cdm"
"7","condition_end_datetime","No","DATE","The date when the instance of the Condition is considered to have ended.","condition_occurrence","cdm"
"8","condition_type_concept_id","Yes","INTEGER","A foreign key to the predefined Concept identifier in the Standardized Vocabularies reflecting the source data from which the condition was recorded, the level of standardization, and the type of occurrence.","condition_occurrence","cdm"
"9","stop_reason","No","VARCHAR(20)","The reason that the condition was no longer present, as indicated in the source data.","condition_occurrence","cdm"
"10","provider_id","No","INTEGER","A foreign key to the Provider in the PROVIDER table who was responsible for capturing (diagnosing) the Condition.","condition_occurrence","cdm"
"11","visit_occurrence_id","No","INTEGER","A foreign key to the visit in the VISIT_OCCURRENCE table during which the Condition was determined (diagnosed).","condition_occurrence","cdm"
"12","visit_detail_id","No","INTEGER","A foreign key to the visit in the VISIT_DETAIL table during which the Condition was determined (diagnosed).","condition_occurrence","cdm"
"13","condition_source_value","No","VARCHAR(50)","The source code for the condition as it appears in the source data. This code is mapped to a standard condition concept in the Standardized Vocabularies and the original code is stored here for reference.","condition_occurrence","cdm"
"14","condition_source_concept_id","No","INTEGER","A foreign key to a Condition Concept that refers to the code used in the source.","condition_occurrence","cdm"
"15","condition_status_source_value","No","VARCHAR(50)","The source code for the condition status as it appears in the source data.","condition_occurrence","cdm"
"16","condition_status_concept_id","No","INTEGER","A foreign key to the predefined Concept in the Standard Vocabulary reflecting the condition status","condition_occurrence","cdm"
"17","person_id","Yes","INTEGER","A foreign key identifier to the deceased person. The demographic details of that person are stored in the person table.","death","cdm"
"18","death_date","Yes","DATE","The date the person was deceased. If the precise date including day or month is not known or not allowed, December is used as the default month, and the last day of the month the default day.","death","cdm"
"19","death_datetime","No","DATETIME","The date and time the person was deceased. If the precise date including day or month is not known or not allowed, December is used as the default month, and the last day of the month the default day.","death","cdm"
"20","death_type_concept_id","Yes","INTEGER","A foreign key referring to the predefined concept identifier in the Standardized Vocabularies reflecting how the death was represented in the source data.","death","cdm"
"21","cause_concept_id","No","INTEGER","A foreign key referring to a standard concept identifier in the Standardized Vocabularies for conditions.","death","cdm"
"22","cause_source_value","No","VARCHAR(50)","The source code for the cause of death as it appears in the source data. This code is mapped to a standard concept in the Standardized Vocabularies and the original code is, stored here for reference.","death","cdm"
"23","cause_source_concept_id","No","INTEGER","A foreign key to the concept that refers to the code used in the source. Note, this variable name is abbreviated to ensure it will be allowable across database platforms.","death","cdm"
"24","device_exposure_id","Yes","INTEGER","A system-generated unique identifier for each Device Exposure.","device_exposure","cdm"
"25","person_id","Yes","INTEGER","A foreign key identifier to the Person who is subjected to the Device. The demographic details of that person are stored in the Person table.","device_exposure","cdm"
"26","device_concept_id","Yes","INTEGER","A foreign key that refers to a Standard Concept identifier in the Standardized Vocabularies for the Device concept.","device_exposure","cdm"
"27","device_exposure_start_date","Yes","DATE","The date the Device or supply was applied or used.","device_exposure","cdm"
"28","device_exposure_start_datetime","No","DATETIME","The date and time the Device or supply was applied or used.","device_exposure","cdm"
"29","device_exposure_end_date","No","DATE","The date the Device or supply was removed from use.","device_exposure","cdm"
"30","device_exposure_end_datetime","No","DATETIME","The date and time the Device or supply was removed from use.","device_exposure","cdm"
"31","device_type_concept_id","Yes","INTEGER","A foreign key to the predefined Concept identifier in the Standardized Vocabularies reflecting the type of Device Exposure recorded. It indicates how the Device Exposure was represented in the source data.","device_exposure","cdm"
"32","unique_device_id","No","VARCHAR(50)","A UDI or equivalent identifying the instance of the Device used in the Person.","device_exposure","cdm"
"33","quantity","No","INTEGER","The number of individual Devices used for the exposure.","device_exposure","cdm"
"34","provider_id","No","INTEGER","A foreign key to the provider in the PROVIDER table who initiated of administered the Device.","device_exposure","cdm"
"35","visit_occurrence_id","No","INTEGER","A foreign key to the visit in the VISIT_OCCURRENCE table during which the device was used.","device_exposure","cdm"
"36","visit_detail_id","No","INTEGER","A foreign key to the visit detail in the VISIT_DETAIL table during which the Drug Exposure was initiated.","device_exposure","cdm"
"37","device_source_value","No","VARCHAR(50)","The source code for the Device as it appears in the source data. This code is mapped to a standard Device Concept in the Standardized Vocabularies and the original code is stored here for reference.","device_exposure","cdm"
"38","device_source_concept_id","No","INTEGER","A foreign key to a Device Concept that refers to the code used in the source.","device_exposure","cdm"
"39","drug_exposure_id","Yes","INTEGER","A system-generated unique identifier for each Drug utilization event.","drug_exposure","cdm"
"40","person_id","Yes","INTEGER","A foreign key identifier to the person who is subjected to the Drug. The demographic details of that person are stored in the person table.","drug_exposure","cdm"
"41","drug_concept_id","Yes","INTEGER","A foreign key that refers to a Standard Concept identifier in the Standardized Vocabularies for the Drug concept.","drug_exposure","cdm"
"42","drug_exposure_start_date","Yes","DATE","The start date for the current instance of Drug utilization. Valid entries include a start date of a prescription, the date a prescription was filled, or the date on which a Drug administration procedure was recorded.","drug_exposure","cdm"
"43","drug_exposure_start_datetime","No","DATETIME","The start date and time for the current instance of Drug utilization. Valid entries include a start date of a prescription, the date a prescription was filled, or the date on which a Drug administration procedure was recorded.","drug_exposure","cdm"
"44","drug_exposure_end_date","Yes","DATE","The end date for the current instance of Drug utilization. It is not available from all sources.","drug_exposure","cdm"
"45","drug_exposure_end_datetime","No","DATETIME","The end date and time for the current instance of Drug utilization. It is not available from all sources.","drug_exposure","cdm"
"46","verbatim_end_date","No","DATE","The known end date of a drug_exposure as provided by the source","drug_exposure","cdm"
"47","drug_type_concept_id","Yes","INTEGER","A foreign key to the predefined Concept identifier in the Standardized Vocabularies reflecting the type of Drug Exposure recorded. It indicates how the Drug Exposure was represented in the source data.","drug_exposure","cdm"
"48","stop_reason","No","VARCHAR(20)","The reason the Drug was stopped. Reasons include regimen completed, changed, removed, etc.","drug_exposure","cdm"
"49","refills","No","INTEGER","The number of refills after the initial prescription. The initial prescription is not counted, values start with 0.","drug_exposure","cdm"
"50","quantity","No","FLOAT","The quantity of drug as recorded in the original prescription or dispensing record.","drug_exposure","cdm"
"51","days_supply","No","INTEGER","The number of days of supply of the medication as recorded in the original prescription or dispensing record.","drug_exposure","cdm"
"52","sig","No","VARCHAR(MAX)","The directions (""signetur"") on the Drug prescription as recorded in the original prescription (and printed on the container) or dispensing record.","drug_exposure","cdm"
"53","route_concept_id","No","INTEGER","A foreign key to a predefined concept in the Standardized Vocabularies reflecting the route of administration.","drug_exposure","cdm"
"54","lot_number","No","VARCHAR(50)","An identifier assigned to a particular quantity or lot of Drug product from the manufacturer.","drug_exposure","cdm"
"55","provider_id","No","INTEGER","A foreign key to the provider in the PROVIDER table who initiated (prescribed or administered) the Drug Exposure.","drug_exposure","cdm"
"56","visit_occurrence_id","No","INTEGER","A foreign key to the Visit in the VISIT_OCCURRENCE table during which the Drug Exposure was initiated.","drug_exposure","cdm"
"57","visit_detail_id","No","INTEGER","A foreign key to the Visit Detail in the VISIT_DETAIL table during which the Drug Exposure was initiated.","drug_exposure","cdm"
"58","drug_source_value","No","VARCHAR(50)","The source code for the Drug as it appears in the source data. This code is mapped to a Standard Drug concept in the Standardized Vocabularies and the original code is, stored here for reference.","drug_exposure","cdm"
"59","drug_source_concept_id","No","INTEGER","A foreign key to a Drug Concept that refers to the code used in the source.","drug_exposure","cdm"
"60","route_source_value","No","VARCHAR(50)","The information about the route of administration as detailed in the source.","drug_exposure","cdm"
"61","dose_unit_source_value","No","VARCHAR(50)","The information about the dose unit as detailed in the source.","drug_exposure","cdm"
"62","domain_concept_id_1","Yes","INTEGER","The concept representing the domain of fact one, from which the corresponding table can be inferred.","fact_relationship","cdm"
"63","fact_id_1","Yes","INTEGER","The unique identifier in the table corresponding to the domain of fact one.","fact_relationship","cdm"
"64","domain_concept_id_2","Yes","INTEGER","The concept representing the domain of fact two, from which the corresponding table can be inferred.","fact_relationship","cdm"
"65","fact_id_2","Yes","INTEGER","The unique identifier in the table corresponding to the domain of fact two.","fact_relationship","cdm"
"66","relationship_concept_id","Yes","INTEGER","A foreign key to a Standard Concept ID of relationship in the Standardized Vocabularies.","fact_relationship","cdm"
"67","measurement_id","Yes","INTEGER","A unique identifier for each Measurement.","measurement","cdm"
"68","person_id","Yes","INTEGER","A foreign key identifier to the Person about whom the measurement was recorded. The demographic details of that Person are stored in the PERSON table.","measurement","cdm"
"69","measurement_concept_id","Yes","INTEGER","A foreign key to the standard measurement concept identifier in the Standardized Vocabularies.","measurement","cdm"
"70","measurement_date","Yes","DATE","The date of the Measurement.","measurement","cdm"
"71","measurement_datetime","No","DATETIME","The date and time of the Measurement. Some database systems don't have a datatype of time. To accomodate all temporal analyses, datatype datetime can be used (combining measurement_date and measurement_time [forum discussion](http://forums.ohdsi.org/t/date-time-and-datetime-problem-and-the-world-of-hours-and-1day/314))","measurement","cdm"
"72","measurement_time","No","VARCHAR(10)","The time of the Measurement. This is present for backwards compatibility and will deprecated in an upcoming version","measurement","cdm"
"73","measurement_type_concept_id","Yes","INTEGER","A foreign key to the predefined Concept in the Standardized Vocabularies reflecting the provenance from where the Measurement record was recorded.","measurement","cdm"
"74","operator_concept_id","No","INTEGER","A foreign key identifier to the predefined Concept in the Standardized Vocabularies reflecting the mathematical operator that is applied to the value_as_number. Operators are <, <=, =, >=, >.","measurement","cdm"
"75","value_as_number","No","FLOAT","A Measurement result where the result is expressed as a numeric value.","measurement","cdm"
"76","value_as_concept_id","No","INTEGER","A foreign key to a Measurement result represented as a Concept from the Standardized Vocabularies (e.g., positive/negative, present/absent, low/high, etc.).","measurement","cdm"
"77","unit_concept_id","No","INTEGER","A foreign key to a Standard Concept ID of Measurement Units in the Standardized Vocabularies.","measurement","cdm"
"78","range_low","No","FLOAT","The lower limit of the normal range of the Measurement result. The lower range is assumed to be of the same unit of measure as the Measurement value.","measurement","cdm"
"79","range_high","No","FLOAT","The upper limit of the normal range of the Measurement. The upper range is assumed to be of the same unit of measure as the Measurement value.","measurement","cdm"
"80","provider_id","No","INTEGER","A foreign key to the provider in the PROVIDER table who was responsible for initiating or obtaining the measurement.","measurement","cdm"
"81","visit_occurrence_id","No","INTEGER","A foreign key to the Visit in the VISIT_OCCURRENCE table during which the Measurement was recorded.","measurement","cdm"
"82","visit_detail_id","No","INTEGER","A foreign key to the Visit Detail in the VISIT_DETAIL table during which the Measurement was recorded.","measurement","cdm"
"83","measurement_source_value","No","VARCHAR(50)","The Measurement name as it appears in the source data. This code is mapped to a Standard Concept in the Standardized Vocabularies and the original code is stored here for reference.","measurement","cdm"
"84","measurement_source_concept_id","No","INTEGER","A foreign key to a Concept in the Standard Vocabularies that refers to the code used in the source.","measurement","cdm"
"85","unit_source_value","No","VARCHAR(50)","The source code for the unit as it appears in the source data. This code is mapped to a standard unit concept in the Standardized Vocabularies and the original code is stored here for reference.","measurement","cdm"
"86","value_source_value","No","VARCHAR(50)","The source value associated with the content of the value_as_number or value_as_concept_id as stored in the source data.","measurement","cdm"
"87","note_id","Yes","INTEGER","A unique identifier for each note.","note","cdm"
"88","person_id","Yes","INTEGER","A foreign key identifier to the Person about whom the Note was recorded. The demographic details of that Person are stored in the PERSON table.","note","cdm"
"89","note_date","Yes","DATE","The date the note was recorded.","note","cdm"
"90","note_datetime","No","DATETIME","The date and time the note was recorded.","note","cdm"
"91","note_type_concept_id","Yes","INTEGER","A foreign key to the predefined Concept in the Standardized Vocabularies reflecting the type, origin or provenance of the Note.","note","cdm"
"92","note_class_concept_id","Yes","INTEGER","A foreign key to the predefined Concept in the Standardized Vocabularies reflecting the HL7 LOINC Document Type Vocabulary classification of the note.","note","cdm"
"93","note_title","No","VARCHAR(250)","The title of the Note as it appears in the source.","note","cdm"
"94","note_text","Yes","VARCHAR(MAX)","The content of the Note.","note","cdm"
"95","encoding_concept_id","Yes","INTEGER","A foreign key to the predefined Concept in the Standardized Vocabularies reflecting the note character encoding type","note","cdm"
"96","language_concept_id","Yes","INTEGER","A foreign key to the predefined Concept in the Standardized Vocabularies reflecting the language of the note","note","cdm"
"97","provider_id","No","INTEGER","A foreign key to the Provider in the PROVIDER table who took the Note.","note","cdm"
"98","visit_occurrence_id","No","INTEGER","A foreign key to the Visit in the VISIT_OCCURRENCE table when the Note was taken.","note","cdm"
"99","visit_detail_id","No","INTEGER","A foreign key to the Visit in the VISIT_DETAIL table when the Note was taken.","note","cdm"
"100","note_source_value","No","VARCHAR(50)","The source value associated with the origin of the Note","note","cdm"
"101","yes","integer","A UNIQUE IDENTIFIER FOR EACH TERM EXTRACTED FROM A NOTE.",NA,"note_nlp","cdm"
"102","yes","integer","A FOREIGN KEY TO THE NOTE TABLE NOTE THE TERM WAS EXTRACTED FROM.",NA,"note_nlp","cdm"
"103","no","integer","A FOREIGN KEY TO THE PREDEFINED CONCEPT IN THE STANDARDIZED VOCABULARIES REPRESENTING THE SECTION OF THE EXTRACTED TERM.",NA,"note_nlp","cdm"
"104","no","varchar(250)","A SMALL WINDOW OF TEXT SURROUNDING THE TERM.",NA,"note_nlp","cdm"
"105","no","varchar(50)","CHARACTER OFFSET OF THE EXTRACTED TERM IN THE INPUT NOTE.",NA,"note_nlp","cdm"
"106","yes","varchar(250)","RAW TEXT EXTRACTED FROM THE NLP TOOL.",NA,"note_nlp","cdm"
"107","no","integer","A FOREIGN KEY TO THE PREDEFINED CONCEPT IN THE STANDARDIZED VOCABULARIES REFLECTING THE NORMALIZED CONCEPT FOR THE EXTRACTED TERM. DOMAIN OF THE TERM IS REPRESENTED AS PART OF THE CONCEPT TABLE.",NA,"note_nlp","cdm"
"108","no","integer","A FOREIGN KEY TO A CONCEPT THAT REFERS TO THE CODE IN THE SOURCE VOCABULARY USED BY THE NLP SYSTEM",NA,"note_nlp","cdm"
"109","no","varchar(250)","NAME AND VERSION OF THE NLP SYSTEM THAT EXTRACTED THE TERM.USEFUL FOR DATA PROVENANCE.",NA,"note_nlp","cdm"
"110","yes","date","THE DATE OF THE NOTE PROCESSING.USEFUL FOR DATA PROVENANCE.",NA,"note_nlp","cdm"
"111","no","datetime","THE DATE AND TIME OF THE NOTE PROCESSING. USEFUL FOR DATA PROVENANCE.",NA,"note_nlp","cdm"
"112","no","varchar(1)","A SUMMARY MODIFIER THAT SIGNIFIES PRESENCE OR ABSENCE OF THE TERM FOR A GIVEN PATIENT. USEFUL FOR QUICK QUERYING.",NA,"note_nlp","cdm"
"113","no","varchar(50)","AN OPTIONAL TIME MODIFIER ASSOCIATED WITH THE EXTRACTED TERM. (FOR NOW “PAST” OR “PRESENT” ONLY). STANDARDIZE IT LATER.",NA,"note_nlp","cdm"
"114","no","varchar(2000)","A COMPACT DESCRIPTION OF ALL THE MODIFIERS OF THE SPECIFIC TERM EXTRACTED BY THE NLP SYSTEM. (E.G. “SON HAS RASH” ? “NEGATED=NO,SUBJECT=FAMILY, CERTAINTY=UNDEF,CONDITIONAL=FALSE,GENERAL=FALSE”).",NA,"note_nlp","cdm"
"115","observation_id","Yes","INTEGER","A unique identifier for each observation.","observation","cdm"
"116","person_id","Yes","INTEGER","A foreign key identifier to the Person about whom the observation was recorded. The demographic details of that Person are stored in the PERSON table.","observation","cdm"
"117","observation_concept_id","Yes","INTEGER","A foreign key to the standard observation concept identifier in the Standardized Vocabularies.","observation","cdm"
"118","observation_date","Yes","DATE","The date of the observation.","observation","cdm"
"119","observation_datetime","No","DATETIME","The date and time of the observation.","observation","cdm"
"120","observation_type_concept_id","Yes","INTEGER","A foreign key to the predefined concept identifier in the Standardized Vocabularies reflecting the type of the observation.","observation","cdm"
"121","value_as_number","No","FLOAT","The observation result stored as a number. This is applicable to observations where the result is expressed as a numeric value.","observation","cdm"
"122","value_as_string","No","VARCHAR(60)","The observation result stored as a string. This is applicable to observations where the result is expressed as verbatim text.","observation","cdm"
"123","value_as_concept_id","No","INTEGER","A foreign key to an observation result stored as a Concept ID. This is applicable to observations where the result can be expressed as a Standard Concept from the Standardized Vocabularies (e.g., positive/negative, present/absent, low/high, etc.).","observation","cdm"
"124","qualifier_concept_id","No","INTEGER","A foreign key to a Standard Concept ID for a qualifier (e.g., severity of drug-drug interaction alert)","observation","cdm"
"125","unit_concept_id","No","INTEGER","A foreign key to a Standard Concept ID of measurement units in the Standardized Vocabularies.","observation","cdm"
"126","provider_id","No","INTEGER","A foreign key to the provider in the PROVIDER table who was responsible for making the observation.","observation","cdm"
"127","visit_occurrence_id","No","INTEGER","A foreign key to the visit in the VISIT_OCCURRENCE table during which the observation was recorded.","observation","cdm"
"128","visit_detail_id","No","INTEGER","A foreign key to the visit in the VISIT_DETAIL table during which the observation was recorded.","observation","cdm"
"129","observation_source_value","No","VARCHAR(50)","The observation code as it appears in the source data. This code is mapped to a Standard Concept in the Standardized Vocabularies and the original code is, stored here for reference.","observation","cdm"
"130","observation_source_concept_id","No","INTEGER","A foreign key to a Concept that refers to the code used in the source.","observation","cdm"
"131","unit_source_value","No","VARCHAR(50)","The source code for the unit as it appears in the source data. This code is mapped to a standard unit concept in the Standardized Vocabularies and the original code is, stored here for reference.","observation","cdm"
"132","qualifier_source_value","No","VARCHAR(50)","The source value associated with a qualifier to characterize the observation","observation","cdm"
"133","observation_period_id","Yes","INTEGER","A unique identifier for each observation period.","observation_period","cdm"
"134","person_id","Yes","INTEGER","A foreign key identifier to the person for whom the observation period is defined. The demographic details of that person are stored in the person table.","observation_period","cdm"
"135","observation_period_start_date","Yes","DATE","The start date of the observation period for which data are available from the data source.","observation_period","cdm"
"136","observation_period_end_date","Yes","DATE","The end date of the observation period for which data are available from the data source.","observation_period","cdm"
"137","period_type_concept_id","Yes","INTEGER","A foreign key identifier to the predefined concept in the Standardized Vocabularies reflecting the source of the observation period information","observation_period","cdm"
"138","person_id","Yes","INTEGER","A unique identifier for each person.","person","cdm"
"139","gender_concept_id","Yes","INTEGER","A foreign key that refers to an identifier in the CONCEPT table for the unique gender of the person.","person","cdm"
"140","year_of_birth","Yes","INTEGER","The year of birth of the person. For data sources with date of birth, the year is extracted. For data sources where the year of birth is not available, the approximate year of birth is derived based on any age group categorization available.","person","cdm"
"141","month_of_birth","No","INTEGER","The month of birth of the person. For data sources that provide the precise date of birth, the month is extracted and stored in this field.","person","cdm"
"142","day_of_birth","No","INTEGER","The day of the month of birth of the person. For data sources that provide the precise date of birth, the day is extracted and stored in this field.","person","cdm"
"143","birth_datetime","No","DATETIME","The date and time of birth of the person.","person","cdm"
"144","race_concept_id","Yes","INTEGER","A foreign key that refers to an identifier in the CONCEPT table for the unique race of the person.","person","cdm"
"145","ethnicity_concept_id","Yes","INTEGER","A foreign key that refers to the standard concept identifier in the Standardized Vocabularies for the ethnicity of the person.","person","cdm"
"146","location_id","No","INTEGER","A foreign key to the place of residency for the person in the location table, where the detailed address information is stored.","person","cdm"
"147","provider_id","No","INTEGER","A foreign key to the primary care provider the person is seeing in the provider table.","person","cdm"
"148","care_site_id","No","INTEGER","A foreign key to the site of primary care in the care_site table, where the details of the care site are stored.","person","cdm"
"149","person_source_value","No","VARCHAR(50)","An (encrypted) key derived from the person identifier in the source data. This is necessary when a use case requires a link back to the person data at the source dataset.","person","cdm"
