cdmTableName,schema,isRequired,conceptPrefix,measurePersonCompleteness,measurePersonCompletenessThreshold,validation,tableDescription,userGuidance,etlConventions
person,CDM,Yes,NA,No,NA,NA,"This table serves as the central identity management for all Persons in the database. It contains records that uniquely identify each person or patient, and some demographic information.",All records in this table are independent Persons.,"All Persons in a database needs one record in this table, unless they fail data quality requirements specified in the ETL. Persons with no Events should have a record nonetheless. If more than one data source contributes Events to the database, Persons must be reconciled, if possible, across the sources to create one single record per Person. The content of the BIRTH_DATETIME must be equivalent to the content of BIRTH_DAY, BIRTH_MONTH and BIRTH_YEAR.<br><br>For detailed conventions for how to populate this table, please refer to the [THEMIS repository](https://ohdsi.github.io/Themis/person.html)."
observation_period,CDM,Yes,NA,Yes,0,NA,"This table contains records which define spans of time during which two conditions are expected to hold: (i) Clinical Events that happened to the Person are recorded in the Event tables, and (ii) absence of records indicate such Events did not occur during this span of time.","For each Person, one or more OBSERVATION_PERIOD records may be present, but they will not overlap or be back to back to each other. Events may exist outside all of the time spans of the OBSERVATION_PERIOD records for a patient, however, absence of an Event outside these time spans cannot be construed as evidence of absence of an Event. Incidence or prevalence rates should only be calculated for the time of active OBSERVATION_PERIOD records. When constructing cohorts, outside Events can be used for inclusion criteria definition, but without any guarantee for the performance of these criteria. Also, OBSERVATION_PERIOD records can be as short as a single day, greatly disturbing the denominator of any rate calculation as part of cohort characterizations. To avoid that, apply minimal observation time as a requirement for any cohort definition.","Each Person needs to have at least one OBSERVATION_PERIOD record, which should represent time intervals with a high capture rate of Clinical Events. Some source data have very similar concepts, such as enrollment periods in insurance claims data. In other source data such as most EHR systems these time spans need to be inferred under a set of assumptions. It is the discretion of the ETL developer to define these assumptions. In many ETL solutions the start date of the first occurrence or the first high quality occurrence of a Clinical Event (Condition, Drug, Procedure, Device, Measurement, Visit) is defined as the start of the OBSERVATION_PERIOD record, and the end date of the last occurrence of last high quality occurrence of a Clinical Event, or the end of the database period becomes the end of the OBSERVATION_PERIOD for each Person. If a Person only has a single Clinical Event the OBSERVATION_PERIOD record can be as short as one day. Depending on these definitions it is possible that Clinical Events fall outside the time spans defined by OBSERVATION_PERIOD records. Family history or history of Clinical Events generally are not used to generate OBSERVATION_PERIOD records around the time they are referring to. Any two overlapping or adjacent OBSERVATION_PERIOD records have to be merged into one."
visit_occurrence,CDM,No,VISIT_,Yes,0,NA,"This table contains Events where Persons engage with the healthcare system for a duration of time. They are often also called ""Encounters"". Visits are defined by a configuration of circumstances under which they occur, such as (i) whether the patient comes to a healthcare institution, the other way around, or the interaction is remote, (ii) whether and what kind of trained medical staff is delivering the service during the Visit, and (iii) whether the Visit is transient or for a longer period involving a stay in bed.","The configuration defining the Visit are described by Concepts in the Visit Domain, which form a hierarchical structure, but rolling up to generally familiar Visits adopted in most healthcare systems worldwide:

- [Inpatient Visit](https://athena.ohdsi.org/search-terms/terms/9201): Person visiting hospital, at a Care Site, in bed, for duration of more than one day, with physicians and other Providers permanently available to deliver service around the clock 
- [Emergency Room Visit](https://athena.ohdsi.org/search-terms/terms/9203): Person visiting dedicated healthcare institution for treating emergencies, at a Care Site, within one day, with physicians and Providers permanently available to deliver service around the clock
- [Emergency Room and Inpatient Visit](https://athena.ohdsi.org/search-terms/terms/262): Person visiting ER followed by a subsequent Inpatient Visit, where Emergency department is part of hospital, and transition from the ER to other hospital departments is undefined
- [Non-hospital institution Visit](https://athena.ohdsi.org/search-terms/terms/42898160): Person visiting dedicated institution for reasons of poor health, at a Care Site, long-term or permanently, with no physician but possibly other Providers permanently available to deliver service around the clock
- [Outpatient Visit](https://athena.ohdsi.org/search-terms/terms/9202): Person visiting dedicated ambulatory healthcare institution, at a Care Site, within one day, without bed, with physicians or medical Providers delivering service during Visit
- [Home Visit](https://athena.ohdsi.org/search-terms/terms/581476): Provider visiting Person, without a Care Site, within one day, delivering service
- [Telehealth Visit](https://athena.ohdsi.org/search-terms/terms/5083): Patient engages with Provider through communication media
- [Pharmacy Visit](https://athena.ohdsi.org/search-terms/terms/581458): Person visiting pharmacy for dispensing of Drug, at a Care Site, within one day
- [Laboratory Visit](https://athena.ohdsi.org/search-terms/terms/32036): Patient visiting dedicated institution, at a Care Site, within one day, for the purpose of a Measurement.
- [Ambulance Visit](https://athena.ohdsi.org/search-terms/terms/581478): Person using transportation service for the purpose of initiating one of the other Visits, without a Care Site, within one day, potentially with Providers accompanying the Visit and delivering service
- [Case Management Visit](https://athena.ohdsi.org/search-terms/terms/38004193): Person interacting with healthcare system, without a Care Site, within a day, with no Providers involved, for administrative purposes

The Visit duration, or 'length of stay', is defined as VISIT_END_DATE - VISIT_START_DATE. For all Visits this is <1 day, except Inpatient Visits and Non-hospital institution Visits. The CDM also contains the VISIT_DETAIL table where additional information about the Visit is stored, for example, transfers between units during an inpatient Visit.","Visits can be derived easily if the source data contain coding systems for Place of Service or Procedures, like CPT codes for well visits. In those cases, the codes can be looked up and mapped to a Standard Visit Concept. Otherwise, Visit Concepts have to be identified in the ETL process. This table will contain concepts in the Visit domain. These concepts are arranged in a hierarchical structure to facilitate cohort definitions by rolling up to generally familiar Visits adopted in most healthcare systems worldwide. Visits can be adjacent to each other, i.e. the end date of one can be identical with the start date of the other. As a consequence, more than one-day Visits or their descendants can be recorded for the same day. Multi-day visits must not overlap, i.e. share days other than start and end days. It is often the case that some logic should be written for how to define visits and how to assign Visit_Concept_Id. For example, in US claims outpatient visits that appear to occur within the time period of an inpatient visit can be rolled into one with the same Visit_Occurrence_Id. In EHR data inpatient visits that are within one day of each other may be strung together to create one visit. It will all depend on the source data and how encounter records should be translated to visit occurrences. Providers can be associated with a Visit through the PROVIDER_ID field, or indirectly through PROCEDURE_OCCURRENCE records linked both to the VISIT and PROVIDER tables."
visit_detail,CDM,No,VISIT_DETAIL_,Yes,0,NA,The VISIT_DETAIL table is an optional table used to represents details of each record in the parent VISIT_OCCURRENCE table. A good example of this would be the movement between units in a hospital during an inpatient stay or claim lines associated with a one insurance claim. For every record in the VISIT_OCCURRENCE table there may be 0 or more records in the VISIT_DETAIL table with a 1:n relationship where n may be 0. The VISIT_DETAIL table is structurally very similar to VISIT_OCCURRENCE table and belongs to the visit domain.,"The configuration defining the Visit Detail is described by Concepts in the Visit Domain, which form a hierarchical structure. The Visit Detail record will have an associated to the Visit Occurrence record in two ways: <br> 1. The Visit Detail record will have the VISIT_OCCURRENCE_ID it is associated to 2. The VISIT_DETAIL_CONCEPT_ID  will be a descendant of the VISIT_CONCEPT_ID for the Visit.","It is not mandatory that the VISIT_DETAIL table be filled in, but if you find that the logic to create VISIT_OCCURRENCE records includes the roll-up of multiple smaller records to create one picture of a Visit then it is a good idea to use VISIT_DETAIL. In EHR data, for example, a Person may be in the hospital but instead of one over-arching Visit their encounters are recorded as times they interacted with a health care provider. A Person in the hospital interacts with multiple providers multiple times a day so the encounters must be strung together using some heuristic (defined by the ETL) to identify the entire Visit. In this case the encounters would be considered Visit Details and the entire Visit would be the Visit Occurrence. In this example it is also possible to use the Vocabulary to distinguish Visit Details from a Visit Occurrence by setting the VISIT_CONCEPT_ID to [9201](https://athena.ohdsi.org/search-terms/terms/9201) and the VISIT_DETAIL_CONCEPT_IDs either to 9201 or its children to indicate where the patient was in the hospital at the time of care."
condition_occurrence,CDM,No,CONDITION_,Yes,0,NA,"This table contains records of Events of a Person suggesting the presence of a disease or medical condition stated as a diagnosis, a sign, or a symptom, which is either observed by a Provider or reported by the patient.","Conditions are defined by Concepts from the Condition domain, which form a complex hierarchy. As a result, the same Person with the same disease may have multiple Condition records, which belong to the same hierarchical family. Most Condition records are mapped from diagnostic codes, but recorded signs, symptoms and summary descriptions also contribute to this table. Rule out diagnoses should not be recorded in this table, but in reality their negating nature is not always captured in the source data, and other precautions must be taken when when identifying Persons who should suffer from the recorded Condition. Record all conditions as they exist in the source data. Any decisions about diagnosis/phenotype definitions would be done through cohort specifications. These cohorts can be housed in the [COHORT](https://ohdsi.github.io/CommonDataModel/cdm54.html#payer_plan_period) table. Conditions span a time interval from start to end, but are typically recorded as single snapshot records with no end date. The reason is twofold: (i) At the time of the recording the duration is not known and later not recorded, and (ii) the Persons typically cease interacting with the healthcare system when they feel better, which leads to incomplete capture of resolved Conditions. The [CONDITION_ERA](https://ohdsi.github.io/CommonDataModel/cdm54.html#condition_era) table addresses this issue. Family history and past diagnoses ('history of') are not recorded in this table. Instead, they are listed in the [OBSERVATION](https://ohdsi.github.io/CommonDataModel/cdm54.html#observation) table. Codes written in the process of establishing the diagnosis, such as 'question of' of and 'rule out', should not represented here. Instead, they should be recorded in the [OBSERVATION](https://ohdsi.github.io/CommonDataModel/cdm54.html#observation) table, if they are used for analyses. However, this information is not always available.",Source codes and source text fields mapped to Standard Concepts of the Condition Domain have to be recorded here.
drug_exposure,CDM,No,DRUG_,Yes,0,NA,"This table captures records about the exposure to a Drug ingested or otherwise introduced into the body. A Drug is a biochemical substance formulated in such a way that when administered to a Person it will exert a certain biochemical effect on the metabolism. Drugs include prescription and over-the-counter medicines, vaccines, and large-molecule biologic therapies. Radiological devices ingested or applied locally do not count as Drugs.","The purpose of records in this table is to indicate an exposure to a certain drug as best as possible. In this context a drug is defined as an active ingredient. Drug Exposures are defined by Concepts from the Drug domain, which form a complex hierarchy. As a result, one DRUG_SOURCE_CONCEPT_ID may map to multiple standard concept ids if it is a combination product. Records in this table represent prescriptions written, prescriptions dispensed, and drugs administered by a provider to name a few. The DRUG_TYPE_CONCEPT_ID can be used to find and filter on these types. This table includes additional information about the drug products, the quantity given, and route of administration.","Information about quantity and dose is provided in a variety of different ways and it is important for the ETL to provide as much information as possible from the data. Depending on the provenance of the data fields may be captured differently i.e. quantity for drugs administered may have a separate meaning from quantity for prescriptions dispensed. If a patient has multiple records on the same day for the same drug or procedures the ETL should not de-dupe them unless there is probable reason to believe the item is a true data duplicate. Take note on how to handle refills for prescriptions written.<br><br>For detailed conventions on how to populate this table, please refer to the [THEMIS repository](https://ohdsi.github.io/Themis/drug_exposure.html)."
procedure_occurrence,CDM,No,PROCEDURE_,Yes,0,NA,"This table contains records of activities or processes ordered by, or carried out by, a healthcare provider on the patient with a diagnostic or therapeutic purpose.","Lab tests are not a procedure, if something is observed with an expected resulting amount and unit then it should be a measurement. Phlebotomy is a procedure but so trivial that it tends to be rarely captured. It can be assumed that there is a phlebotomy procedure associated with many lab tests, therefore it is unnecessary to add them as separate procedures.","When dealing with duplicate records, the ETL must determine whether to sum them up into one record or keep them separate. Things to consider are: 

- Same Procedure 
- Same procedure_datetime
- Same Visit Occurrence or Visit Detail 
- Same Provider 
- Same Modifier for Procedures. 

Source codes and source text fields mapped to Standard Concepts of the Procedure Domain have to be recorded here."
device_exposure,CDM,No,DEVICE_,Yes,0,NA,"The Device domain captures information about a person's exposure to a foreign physical object or instrument which is used for diagnostic or therapeutic purposes through a mechanism beyond chemical action. Devices include implantable objects (e.g. pacemakers, stents, artificial joints), medical equipment and supplies (e.g. bandages, crutches, syringes), other instruments used in medical procedures (e.g. sutures, defibrillators) and material used in clinical care (e.g. adhesives, body material, dental material, surgical material).","The distinction between Devices or supplies and Procedures are sometimes blurry, but the former are physical objects while the latter are actions, often to apply a Device or supply.",Source codes and source text fields mapped to Standard Concepts of the Device Domain have to be recorded here.
measurement,CDM,No,MEASUREMENT_,Yes,0,NA,"The MEASUREMENT table contains records of Measurements, i.e. structured values (numerical or categorical) obtained through systematic and standardized examination or testing of a Person or Person's sample. The MEASUREMENT table contains both orders and results of such Measurements as laboratory tests, vital signs, quantitative findings from pathology reports, etc. Measurements are stored as attribute value pairs, with the attribute as the Measurement Concept and the value representing the result. The value can be a Concept (stored in VALUE_AS_CONCEPT), or a numerical value (VALUE_AS_NUMBER) with a Unit (UNIT_CONCEPT_ID). The Procedure for obtaining the sample is housed in the PROCEDURE_OCCURRENCE table, though it is unnecessary to create a PROCEDURE_OCCURRENCE record for each measurement if one does not exist in the source data. Measurements differ from Observations in that they require a standardized test or some other activity to generate a quantitative or qualitative result. If there is no result, it is assumed that the lab test was conducted but the result was not captured.","Measurements are predominately lab tests with a few exceptions, like blood pressure or function tests. Results are given in the form of a value and unit combination. When investigating measurements, look for operator_concept_ids (<, >, etc.).","Only records where the source value maps to a Concept in the measurement domain should be included in this table. Even though each Measurement always has a result, the fields VALUE_AS_NUMBER and VALUE_AS_CONCEPT_ID are not mandatory as often the result is not given in the source data. When the result is not known, the Measurement record represents just the fact that the corresponding Measurement was carried out, which in itself is already useful information for some use cases. For some Measurement Concepts, the result is included in the test. For example, ICD10 CONCEPT_ID [45548980](https://athena.ohdsi.org/search-terms/terms/45548980) 'Abnormal level of unspecified serum enzyme' indicates a Measurement and the result (abnormal). In those situations, the CONCEPT_RELATIONSHIP table in addition to the 'Maps to' record contains a second record with the relationship_id set to 'Maps to value'. In this example, the 'Maps to' relationship directs to [4046263](https://athena.ohdsi.org/search-terms/terms/4046263) 'Enzyme measurement' as well as a 'Maps to value' record to [4135493](https://athena.ohdsi.org/search-terms/terms/4135493) 'Abnormal'."
observation,CDM,No,OBSERVATION_,Yes,0,NA,"The OBSERVATION table captures clinical facts about a Person obtained in the context of examination, questioning or a procedure. Any data that cannot be represented by any other domains, such as social and lifestyle facts, medical history, family history, etc. are recorded here.","Observations differ from Measurements in that they do not require a standardized test or some other activity to generate clinical fact. Typical observations are medical history, family history, the stated need for certain treatment, social circumstances, lifestyle choices, healthcare utilization patterns, etc. If the generation clinical facts requires a standardized testing such as lab testing or imaging and leads to a standardized result, the data item is recorded in the MEASUREMENT table. If the clinical fact observed determines a sign, symptom, diagnosis of a disease or other medical condition, it is recorded in the CONDITION_OCCURRENCE table. Valid Observation Concepts are not enforced to be from any domain but they must not belong to the Condition, Procedure, Drug, Device, Specimen, or Measurement domains and they must be Standard Concepts. <br><br>The observation table usually records the date or datetime of when the observation was obtained, not the date of the observation starting. For example, if the patient reports that they had a heart attack when they were 50, the observation date or datetime is the date of the report, the heart attack observation can have a value_as_concept which captures how long ago the observation applied to the patient.","Records whose Source Values map to any domain besides Condition, Procedure, Drug, Specimen, Measurement or Device should be stored in the Observation table. Observations can be stored as attribute value pairs, with the attribute as the Observation Concept and the value representing the clinical fact. This fact can be a Concept (stored in VALUE_AS_CONCEPT), a numerical value (VALUE_AS_NUMBER) or a verbatim string (VALUE_AS_STRING). Even though Observations do not have an explicit result, the clinical fact can be stated separately from the type of Observation in the VALUE_AS_* fields. It is recommended for Observations that are suggestive statements of positive assertion should have a value of 'Yes' (concept_id=4188539), recorded, even though the null value is the equivalent."
death,CDM,No,NA,No,NA,NA,"The death domain contains the clinical event for how and when a Person dies. A person can have up to one record if the source system contains evidence about the Death, such as: Condition in an administrative claim, status of enrollment into a health plan, or explicit record in EHR data.",NA,"For specific conventions on how to populate this table, please refer to the [THEMIS repository](https://ohdsi.github.io/Themis/death.html)."
note,CDM,No,NA,Yes,0,NA,"The NOTE table captures unstructured information that was recorded by a provider about a patient in free text (in ASCII, or preferably in UTF8 format) notes on a given date. The type of note_text is CLOB or varchar(MAX) depending on RDBMS.",NA,"HL7/LOINC CDO is a standard for consistent naming of documents to support a range of use cases: retrieval, organization, display, and exchange. It guides the creation of LOINC codes for clinical notes. CDO annotates each document with 5 dimensions:

- **Kind of Document**: Characterizes the general structure of the document at a macro level (e.g. Anesthesia Consent)
- **Type of Service**: Characterizes the kind of service or activity (e.g. evaluations, consultations, and summaries). The notion of time sequence, e.g., at the beginning (admission) at the end (discharge) is subsumed in this axis. Example: Discharge Teaching.
- **Setting**: Setting is an extension of CMS's definitions (e.g. Inpatient, Outpatient)
- **Subject Matter Domain (SMD)**: Characterizes the subject matter domain of a note (e.g. Anesthesiology)
- **Role**: Characterizes the training or professional level of the author of the document, but does not break down to specialty or subspecialty (e.g. Physician)
Each combination of these 5 dimensions rolls up to a unique LOINC code.

According to CDO requirements, only 2 of the 5 dimensions are required to properly annotate a document; Kind of Document and any one of the other 4 dimensions.
However, not all the permutations of the CDO dimensions will necessarily yield an existing LOINC code. Each of these dimensions are contained in the OMOP Vocabulary under the domain of 'Meas Value' with each dimension represented as a Concept Class."
note_nlp,CDM,No,NA,No,NA,NA,The NOTE_NLP table encodes all output of NLP on clinical notes. Each row represents a single extracted term from a note.,NA,NA
specimen,CDM,No,SPECIMEN_,Yes,0,NA,The specimen domain contains the records identifying biological samples from a person.,NA,"Anatomic site is coded at the most specific level of granularity possible, such that higher level classifications can be derived using the Standardized Vocabularies."
fact_relationship,CDM,No,NA,No,NA,NA,"The FACT_RELATIONSHIP table contains records about the relationships between facts stored as records in any table of the CDM. Relationships can be defined between facts from the same domain, or different domains. Examples of Fact Relationships include: [Person relationships](https://athena.ohdsi.org/search-terms/terms?domain=Relationship&standardConcept=Standard&page=2&pageSize=15&query=) (parent-child), care site relationships (hierarchical organizational structure of facilities within a health system), indication relationship (between drug exposures and associated conditions), usage relationships (of devices during the course of an associated procedure), or facts derived from one another (measurements derived from an associated specimen).",NA,"All relationships are directional, and each relationship is represented twice symmetrically within the FACT_RELATIONSHIP table. For example, two persons if person_id = 1 is the mother of person_id = 2 two records are in the FACT_RELATIONSHIP table (all strings in fact concept_id records in the Concept table:
- Person, 1, Person, 2, parent of
- Person, 2, Person, 1, child of"
