cdmTableName,schema,isRequired,conceptPrefix,measurePersonCompleteness,measurePersonCompletenessThreshold,validation,tableDescription,userGuidance,etlConventions
location,CDM,No,NA,No,NA,NA,The LOCATION table represents a generic way to capture physical location or address information of Persons and Care Sites.,"The current iteration of the LOCATION table is US centric. Until a major release to correct this, certain fields can be used to represent different international values. <br><br> - STATE can also be used for province or district<br>- ZIP is also the postal code or postcode <br>- COUNTY can also be used to represent region","Each address or Location is unique and is present only once in the table. Locations do not contain names, such as the name of a hospital. In order to construct a full address that can be used in the postal service, the address information from the Location needs to be combined with information from the Care Site."
care_site,CDM,No,NA,No,NA,NA,"The CARE_SITE table contains a list of uniquely identified institutional (physical or organizational) units where healthcare delivery is practiced (offices, wards, hospitals, clinics, etc.).",NA,"Care site is a unique combination of location_id and nature of the site - the latter could be the place of service, name, or another characteristic in your source data. Care site does not take into account the provider (human) information such a specialty. Many source data do not make a distinction between individual and institutional providers. The CARE_SITE table contains the institutional providers. If the source, instead of uniquely identifying individual Care Sites, only provides limited information such as Place of Service, generic or ""pooled"" Care Site records are listed in the CARE_SITE table. There can be hierarchical and business relationships between Care Sites. For example, wards can belong to clinics or departments, which can in turn belong to hospitals, which in turn can belong to hospital systems, which in turn can belong to HMOs.The relationships between Care Sites are defined in the FACT_RELATIONSHIP table.<br><br>For additional detailed conventions on how to populate this table, please refer to [THEMIS repository](https://ohdsi.github.io/Themis/care_site.html)."
provider,CDM,No,NA,No,NA,NA,"The PROVIDER table contains a list of uniquely identified healthcare providers; duplication is not allowed. These are individuals providing hands-on healthcare to patients, such as physicians, nurses, midwives, physical therapists etc.","Many sources do not make a distinction between individual and institutional providers. The PROVIDER table contains the individual providers. If the source only provides limited information such as specialty instead of uniquely identifying individual providers, generic or 'pooled' Provider records are listed in the PROVIDER table.",NA
payer_plan_period,CDM,No,NA,Yes,0,NA,"The PAYER_PLAN_PERIOD table captures details of the period of time that a Person is continuously enrolled under a specific health Plan benefit structure from a given Payer. Each Person receiving healthcare is typically covered by a health benefit plan, which pays for (fully or partially), or directly provides, the care. These benefit plans are provided by payers, such as health insurances or state or government agencies. In each plan the details of the health benefits are defined for the Person or her family, and the health benefit Plan might change over time typically with increasing utilization (reaching certain cost thresholds such as deductibles), plan availability and purchasing choices of the Person. The unique combinations of Payer organizations, health benefit Plans and time periods in which they are valid for a Person are recorded in this table.","A Person can have multiple, overlapping, Payer_Plan_Periods in this table. For example, medical and drug coverage in the US can be represented by two Payer_Plan_Periods. The details of the benefit structure of the Plan is rarely known, the idea is just to identify that the Plans are different.",NA
cost,CDM,No,NA,No,NA,NA,"The COST table captures records containing the cost of any medical event recorded in one of the OMOP clinical event tables such as DRUG_EXPOSURE, PROCEDURE_OCCURRENCE, VISIT_OCCURRENCE, VISIT_DETAIL, DEVICE_OCCURRENCE, OBSERVATION or MEASUREMENT.

Each record in the cost table account for the amount of money transacted for the clinical event. So, the COST table may be used to represent both receivables (charges) and payments (paid), each transaction type represented by its COST_CONCEPT_ID. The COST_TYPE_CONCEPT_ID field will use concepts in the Standardized Vocabularies to designate the source (provenance) of the cost data. A reference to the health plan information in the PAYER_PLAN_PERIOD table is stored in the record for information used for the adjudication system to determine the persons benefit for the clinical event.","When dealing with summary costs, the cost of the goods or services the provider provides is often not known directly, but derived from the hospital charges multiplied by an average cost-to-charge ratio.","One cost record is generated for each response by a payer. In a claims databases, the payment and payment terms reported by the payer for the goods or services billed will generate one cost record. If the source data has payment information for more than one payer (i.e. primary insurance and secondary insurance payment for one entity), then a cost record is created for each reporting payer. Therefore, it is possible for one procedure to have multiple cost records for each payer, but typically it contains one or no record per entity. Payer reimbursement cost records will be identified by using the PAYER_PLAN_ID field. Drug costs are composed of ingredient cost (the amount charged by the wholesale distributor or manufacturer), the dispensing fee (the amount charged by the pharmacy and the sales tax)."
drug_era,CDM,No,NA,Yes,0,NA,"A Drug Era is defined as a span of time when the Person is assumed to be exposed to a particular active ingredient. A Drug Era is not the same as a Drug Exposure: Exposures are individual records corresponding to the source when Drug was delivered to the Person, while successive periods of Drug Exposures are combined under certain rules to produce continuous Drug Eras. Every record in the DRUG_EXPOSURE table should be part of a drug era based on the dates of exposure. ",NA,The SQL script for generating DRUG_ERA records can be found [here](https://ohdsi.github.io/CommonDataModel/sqlScripts.html#drug_eras).
dose_era,CDM,No,NA,Yes,0,NA,A Dose Era is defined as a span of time when the Person is assumed to be exposed to a constant dose of a specific active ingredient.,NA,"Dose Eras will be derived from records in the DRUG_EXPOSURE table and the Dose information from the DRUG_STRENGTH table using a standardized algorithm. Dose Form information is not taken into account. So, if the patient changes between different formulations, or different manufacturers with the same formulation, the Dose Era is still spanning the entire time of exposure to the Ingredient."
condition_era,CDM,No,NA,Yes,0,NA,"A Condition Era is defined as a span of time when the Person is assumed to have a given condition. Similar to Drug Eras, Condition Eras are chronological periods of Condition Occurrence and every Condition Occurrence record should be part of a Condition Era. Combining individual Condition Occurrences into a single Condition Era serves two purposes:

- It allows aggregation of chronic conditions that require frequent ongoing care, instead of treating each Condition Occurrence as an independent event.
- It allows aggregation of multiple, closely timed doctor visits for the same Condition to avoid double-counting the Condition Occurrences.
For example, consider a Person who visits her Primary Care Physician (PCP) and who is referred to a specialist. At a later time, the Person visits the specialist, who confirms the PCP's original diagnosis and provides the appropriate treatment to resolve the condition. These two independent doctor visits should be aggregated into one Condition Era.",NA,"Each Condition Era corresponds to one or many Condition Occurrence records that form a continuous interval.
The condition_concept_id field contains Concepts that are identical to those of the CONDITION_OCCURRENCE table records that make up the Condition Era. In contrast to Drug Eras, Condition Eras are not aggregated to contain Conditions of different hierarchical layers. The SQl Script for generating CONDITION_ERA records can be found [here](https://ohdsi.github.io/CommonDataModel/sqlScripts.html#condition_eras)
The Condition Era Start Date is the start date of the first Condition Occurrence.
The Condition Era End Date is the end date of the last Condition Occurrence. Condition Eras are built with a Persistence Window of 30 days, meaning, if no occurrence of the same condition_concept_id happens within 30 days of any one occurrence, it will be considered the condition_era_end_date."
episode,CDM,No,NA,No,NA,NA,"The EPISODE table aggregates lower-level clinical events (VISIT_OCCURRENCE, DRUG_EXPOSURE, PROCEDURE_OCCURRENCE, DEVICE_EXPOSURE) into a higher-level abstraction representing clinically and analytically relevant disease phases,outcomes and treatments. The EPISODE_EVENT table connects qualifying clinical events (VISIT_OCCURRENCE, DRUG_EXPOSURE, PROCEDURE_OCCURRENCE, DEVICE_EXPOSURE) to the appropriate EPISODE entry. For example cancers including their development over time, their treatment, and final resolution.","Valid Episode Concepts belong to the 'Episode' domain. For cancer episodes please see [article], for non-cancer episodes please see [article]. If your source data does not have all episodes that are relevant to the therapeutic area, write only those you can easily derive from the data. It is understood that that table is not currently expected to be comprehensive.",NA
episode_event,CDM,No,NA,No,NA,NA,"The EPISODE_EVENT table connects qualifying clinical events (such as CONDITION_OCCURRENCE, DRUG_EXPOSURE, PROCEDURE_OCCURRENCE, MEASUREMENT) to the appropriate EPISODE entry. For example, linking the precise location of the metastasis (cancer modifier in MEASUREMENT) to the disease episode.",This connecting table is used instead of the FACT_RELATIONSHIP table for linking low-level events to abstracted Episodes.,"Some episodes may not have links to any underlying clinical events. For such episodes, the EPISODE_EVENT table is not populated."
metadata,CDM,No,NA,No,NA,NA,The METADATA table contains metadata information about a dataset that has been transformed to the OMOP Common Data Model.,NA,NA
cdm_source,CDM,No,NA,No,NA,NA,The CDM_SOURCE table contains detail about the source database and the process used to transform the data into the OMOP Common Data Model.,NA,NA
concept,VOCAB,No,NA,No,NA,NA,"The Standardized Vocabularies contains records, or Concepts, that uniquely identify each fundamental unit of meaning used to express clinical information in all domain tables of the CDM. Concepts are derived from vocabularies, which represent clinical information across a domain (e.g. conditions, drugs, procedures) through the use of codes and associated descriptions. Some Concepts are designated Standard Concepts, meaning these Concepts can be used as normative expressions of a clinical entity within the OMOP Common Data Model and standardized analytics. Each Standard Concept belongs to one Domain, which defines the location where the Concept would be expected to occur within the data tables of the CDM. Concepts can represent broad categories ('Cardiovascular disease'), detailed clinical elements ('Myocardial infarction of the anterolateral wall'), or modifying characteristics and attributes that define Concepts at various levels of detail (severity of a disease, associated morphology, etc.). Records in the Standardized Vocabularies tables are derived from national or international vocabularies such as SNOMED-CT, RxNorm, and LOINC, or custom OMOP Concepts defined to cover various aspects of observational data analysis.","The primary purpose of the CONCEPT table is to provide a standardized representation of medical Concepts, allowing for consistent querying and analysis across the healthcare databases. Users can join the CONCEPT table with other tables in the CDM to enrich clinical data with standardized Concept information or use the CONCEPT table as a reference for mapping clinical data from source terminologies to Standard Concepts.",NA
vocabulary,VOCAB,No,NA,No,NA,NA,The VOCABULARY table includes a list of the Vocabularies integrated from various sources or created de novo in OMOP CDM. This reference table contains a single record for each Vocabulary and includes a descriptive name and other associated attributes for the Vocabulary.,"The primary purpose of the VOCABULARY table is to provide explicit information about specific vocabulary versions and the references to the sources from which they are asserted. Users can identify the version of a particular vocabulary used in the database, enabling consistency and reproducibility in data analysis. Besides, users can check the vocabulary release version in their CDM which refers to the vocabulary_id = 'None'.",NA
domain,VOCAB,No,NA,No,NA,NA,"The DOMAIN table includes a list of OMOP-defined Domains to which the Concepts of the Standardized Vocabularies can belong. A Domain represents a clinical definition whereby we assign matching Concepts for the standardized fields in the CDM tables. For example, the Condition Domain contains Concepts that describe a patient condition, and these Concepts can only be used in the condition_concept_id field of the CONDITION_OCCURRENCE and CONDITION_ERA tables. This reference table is populated with a single record for each Domain, including a Domain ID and a descriptive name for every Domain.","Users can leverage the DOMAIN table to explore the full spectrum of health-related data Domains available in the Standardized Vocabularies. Also, the information in the DOMAIN table may be used as a reference for mapping source data to OMOP domains, facilitating data harmonization and interoperability.",NA
concept_class,VOCAB,No,NA,No,NA,NA,"The CONCEPT_CLASS table includes semantic categories that reference the source structure of each Vocabulary. Concept Classes represent so-called horizontal (e.g. MedDRA, RxNorm) or vertical levels (e.g. SNOMED) of the vocabulary structure. Vocabularies without any Concept Classes, such as HCPCS, use the vocabulary_id as the Concept Class. This reference table is populated with a single record for each Concept Class, which includes a Concept Class ID and a fully specified Concept Class name.
",Users can utilize the CONCEPT_CLASS table to explore the different classes or categories of concepts within the OHDSI vocabularies.,NA
concept_relationship,VOCAB,No,NA,No,NA,NA,"The CONCEPT_RELATIONSHIP table contains records that define relationships between any two Concepts and the nature or type of the relationship. This table captures various types of relationships, including hierarchical, associative, and other semantic connections, enabling comprehensive analysis and interpretation of clinical concepts. Every kind of relationship is defined in the RELATIONSHIP table.","The CONCEPT_RELATIONSHIP table can be used to explore hierarchical or attribute relationships between concepts to understand the hierarchical structure of clinical concepts and uncover implicit connections and associations within healthcare data. For example, users can utilize mapping relationships ('Maps to') to harmonize data from different sources and terminologies, enabling interoperability and data integration across disparate datasets.",NA
relationship,VOCAB,No,NA,No,NA,NA,"The RELATIONSHIP table provides a reference list of all types of relationships that can be used to associate any two Concepts in the CONCEPT_RELATIONSHIP table, the respective reverse relationships, and their hierarchical characteristics. Note, that Concepts representing relationships between the clinical facts, used for filling in the FACT_RELATIONSHIP table are stored in the CONCEPT table and belong to the Relationship Domain.","Users can leverage the RELATIONSHIP table to explore the full list of direct and reverse relationships within the OMOP vocabulary system. Also, users can get insight into how these relationships can be used in ETL, cohort creation, and other tasks according to their ancestral characteristics.",NA
concept_synonym,VOCAB,No,NA,No,NA,NA,"The CONCEPT_SYNONYM table captures alternative terms, synonyms, and translations of Concept Name into various languages linked to specific concepts, providing users with a comprehensive view of how Concepts may be expressed or referenced.","Users can leverage the CONCEPT_SYNONYM table to expand search capabilities and improve query accuracy by incorporating synonymous terms into data analysis and retrieval processes. Also, users can enhance their mapping efforts between local terminologies and standardized concepts by identifying synonymous terms associated with concepts in the CONCEPT_SYNONYM table.",NA
concept_ancestor,VOCAB,No,NA,No,NA,NA,"The CONCEPT_ANCESTOR table is designed to simplify observational analysis by providing the complete hierarchical relationships between Concepts. Only direct parent-child relationships between Concepts are stored in the CONCEPT_RELATIONSHIP table. To determine higher-level ancestry connections, all individual direct relationships would have to be navigated at analysis time. The CONCEPT_ANCESTOR table includes records for all parent-child relationships, as well as grandparent-grandchild relationships and those of any other level of lineage for Standard or Classification concepts. Using the CONCEPT_ANCESTOR table allows for querying for all descendants of a hierarchical concept, and the other way around. For example, drug ingredients and drug products, beneath them in the hierarchy, are all descendants of a drug class ancestor. This table is entirely derived from the CONCEPT, CONCEPT_RELATIONSHIP, and RELATIONSHIP tables.","The CONCEPT_ANCESTOR table can be used to explore the hierarchical relationships captured in the table to gain insights into the hierarchical structure of clinical concepts. Understanding the hierarchical relationships of concepts can facilitate accurate interpretation and analysis of healthcare data. Also, by incorporating hierarchical relationships from the CONCEPT_ANCESTOR table, users can create cohorts containing related concepts within a hierarchical structure, enabling more comprehensive cohort definitions.",NA
source_to_concept_map,VOCAB,No,NA,No,NA,NA,"The source to concept map table is recommended for use in ETL processes to maintain local source codes which are not available as Concepts in the Standardized Vocabularies, and to establish mappings for each source code into a Standard Concept as target_concept_ids that can be used to populate the Common Data Model tables. The SOURCE_TO_CONCEPT_MAP table is no longer populated with content within the Standardized Vocabularies published to the OMOP community. **There are OHDSI tools to help you populate this table; [Usagi](https://github.com/OHDSI/Usagi) and [Perseus](https://github.com/ohdsi/Perseus). You can read more about OMOP vocabulary mapping in [The Book of OHDSI Chapter 6.3](https://ohdsi.github.io/TheBookOfOhdsi/ExtractTransformLoad.html#step-2-create-the-code-mappings).**",NA,NA
drug_strength,VOCAB,No,NA,No,NA,NA,The DRUG_STRENGTH table contains structured content about the amount or concentration and associated units of a specific ingredient contained within a particular drug product. This table is supplemental information to support standardized analysis of drug utilization.,NA,NA
cohort,RESULTS,No,NA,No,NA,NA,"The subject of a cohort can have multiple, discrete records in the cohort table per cohort_definition_id, subject_id, and non-overlapping time periods. The definition of the cohort is contained within the COHORT_DEFINITION table. It is listed as part of the RESULTS schema because it is a table that users of the database as well as tools such as ATLAS need to be able to write to. The CDM and Vocabulary tables are all read-only so it is suggested that the COHORT and COHORT_DEFINTION tables are kept in a separate schema to alleviate confusion.",NA,"Cohorts typically include patients diagnosed with a specific condition, patients exposed to a particular drug, but can also be Providers who have performed a specific Procedure. Cohort records must have a Start Date and an End Date, but the End Date may be set to Start Date or could have an applied censor date using the Observation Period Start Date. Cohort records must contain a Subject Id, which can refer to the Person, Provider, Visit record or Care Site though they are most often Person Ids. The Cohort Definition will define the type of subject through the subject concept id. A subject can belong (or not belong) to a cohort at any moment in time. A subject can only have one record in the cohort table for any moment of time, i.e. it is not possible for a person to contain multiple records indicating cohort membership that are overlapping in time"
cohort_definition,RESULTS,No,NA,No,NA,NA,"The COHORT_DEFINITION table contains records defining a Cohort derived from the data through the associated description and syntax and upon instantiation (execution of the algorithm) placed into the COHORT table. Cohorts are a set of subjects that satisfy a given combination of inclusion criteria for a duration of time. The COHORT_DEFINITION table provides a standardized structure for maintaining the rules governing the inclusion of a subject into a cohort, and can store operational programming code to instantiate the cohort within the OMOP Common Data Model.",NA,NA